{
  "slug": "anibal-gaete",
  "type": "artist",
  "name": "Aníbal Gaete",
  "artistic_name": null,
  "commune": "olmue",
  "commune_basis": "prensa",
  "crafts": [
    "actuacion"
  ],
  "disciplines": [
    "teatro"
  ],
  "specialties": [],
  "bio_md": null,
  "trajectory_md": null,
  "companies": [],
  "companies_text": [],
  "works": [],
  "works_text": [],
  "training": [],
  "recognitions": [],
  "funding_awards": [],
  "festivals": [],
  "website": null,
  "social": {
    "instagram": null,
    "facebook": null,
    "tiktok": null,
    "youtube": null
  },
  "email_public": null,
  "contact_authorized": false,
  "media": [],
  "media_candidates": [],
  "series": [],
  "episodes": [],
  "tags": [],
  "sources": [
    {
      "url": "https://www.cultura.gob.cl/eventos-actividades/mes-del-teatro-se-conmemorara-con-nuevos-estrenos-teatro-familiar-y-obras-inclusivas/",
      "title": "Mes del Teatro se conmemorará con nuevos estrenos, teatro familiar y obras inclusivas",
      "publisher": "Ministerio de las Culturas, las Artes y el Patrimonio",
      "type": "institucional",
      "level": 1,
      "role": "primaria",
      "accessed_at": "2026-09-08",
      "archived_url": null,
      "supports": [],
      "notes": "Nota del 10 de mayo de 2022 con la programación regional del Mes del Teatro (11 al 28 de mayo de 2022)."
    }
  ],
  "verification": {
    "status": "pendiente",
    "confidence_score": 35,
    "verified_at": null,
    "verified_by": null,
    "next_review_at": null,
    "note": "Importado del catastro regional del ecosistema teatral (Fase 1: descubrimiento); pendiente de verificación editorial."
  },
  "published": false
}
