{
  "slug": "claudio-rodriguez",
  "type": "artist",
  "name": "Claudio Rodríguez",
  "artistic_name": null,
  "commune": "valparaiso",
  "commune_basis": "prensa",
  "crafts": [
    "direccion"
  ],
  "disciplines": [
    "teatro"
  ],
  "specialties": [],
  "bio_md": null,
  "trajectory_md": null,
  "companies": [
    {
      "company": "laboratorio-anatomia-teatral",
      "role": "Director/a",
      "from_year": null,
      "to_year": null
    }
  ],
  "companies_text": [],
  "works": [],
  "works_text": [],
  "training": [],
  "recognitions": [],
  "funding_awards": [],
  "festivals": [],
  "website": null,
  "social": {
    "instagram": null,
    "facebook": null,
    "tiktok": null,
    "youtube": null
  },
  "email_public": null,
  "contact_authorized": false,
  "media": [],
  "media_candidates": [],
  "series": [],
  "episodes": [],
  "tags": [],
  "sources": [
    {
      "url": "https://parquecultural.cl/2019/05/03/festival-sintesis-teatral-valparaiso-encabeza-celebracion-del-mes-del-teatro/",
      "title": "Festival Síntesis Teatral Valparaíso encabeza celebración del mes del teatro",
      "publisher": "Parque Cultural de Valparaíso",
      "type": "institucional",
      "level": 1,
      "role": "primaria",
      "accessed_at": "2026-09-08",
      "archived_url": null,
      "supports": [],
      "notes": "Nota del 3 de mayo de 2019; organiza Laboratorio Anatomía Teatral (dir. Claudio Rodríguez); programa completo en laboratorioanatomiateatral.cl/folleto-fstv19."
    },
    {
      "url": "https://teatroamil.cl/articulos/festival-sintesis-teatral-valparaiso-2019/",
      "title": "Festival Síntesis encabeza celebración del Día Nacional del Teatro en Valparaíso",
      "publisher": "Fundación Teatro a Mil",
      "type": "prensa",
      "level": 2,
      "role": "secundaria",
      "accessed_at": "2026-09-08",
      "archived_url": null,
      "supports": [],
      "notes": "Cuarta versión (2019): 6 al 26 de mayo, 23 obras, 5 estrenos, más de 30 presentaciones en 8 espacios; extensión a San Antonio, Quillota, Quilpué, San Felipe y Olmué."
    }
  ],
  "verification": {
    "status": "pendiente",
    "confidence_score": 60,
    "verified_at": null,
    "verified_by": null,
    "next_review_at": null,
    "note": "Importado del catastro regional del ecosistema teatral (Fase 1: descubrimiento); pendiente de verificación editorial."
  },
  "published": false
}
