{
  "slug": "danilo-llanos",
  "type": "artist",
  "name": "Danilo Llanos",
  "artistic_name": null,
  "commune": "valparaiso",
  "commune_basis": "prensa",
  "crafts": [
    "direccion",
    "dramaturgia"
  ],
  "disciplines": [
    "teatro"
  ],
  "specialties": [],
  "bio_md": null,
  "trajectory_md": null,
  "companies": [
    {
      "company": "teatro-la-peste",
      "role": "Director/a",
      "from_year": null,
      "to_year": null
    }
  ],
  "companies_text": [],
  "works": [],
  "works_text": [],
  "training": [],
  "recognitions": [],
  "funding_awards": [],
  "festivals": [],
  "website": null,
  "social": {
    "instagram": null,
    "facebook": null,
    "tiktok": null,
    "youtube": null
  },
  "email_public": null,
  "contact_authorized": false,
  "media": [],
  "media_candidates": [],
  "series": [],
  "episodes": [],
  "tags": [],
  "sources": [
    {
      "url": "https://www.biobiochile.cl/noticias/artes-y-cultura/teatro/2025/11/13/teatro-la-peste-celebra-25-anos-con-adaptacion-de-novela-de-diamela-eltit.shtml",
      "title": "Teatro La Peste celebra 25 años con adaptación de novela de Diamela Eltit",
      "publisher": "BioBioChile",
      "type": "prensa",
      "level": 2,
      "role": "primaria",
      "accessed_at": "2026-09-05",
      "archived_url": null,
      "supports": [],
      "notes": "Confirma 25 años de trayectoria a noviembre de 2025 y el estreno de SUMAR, archivos del fracaso el 13 de noviembre de 2025."
    },
    {
      "url": "https://www.uv.cl/archivo-noticias-uv/28396-teatro-la-peste-conmemora-25-anos-con-obra-error-en-sala-negra-uv",
      "title": "Teatro La Peste conmemora 25 años con obra «Error» en Sala Negra UV",
      "publisher": "Universidad de Valparaíso",
      "type": "institucional",
      "level": 1,
      "role": "secundaria",
      "accessed_at": "2026-09-05",
      "archived_url": null,
      "supports": [],
      "notes": "Fuente institucional (universidad) que confirma comuna (Valparaíso, «compañía porteña»), director y trayectoria."
    },
    {
      "url": "https://parquecultural.cl/events/sumar-teatro-la-peste/",
      "title": "Sumar - Teatro La Peste",
      "publisher": "Parque Cultural de Valparaíso",
      "type": "institucional",
      "level": 1,
      "role": "secundaria",
      "accessed_at": "2026-09-05",
      "archived_url": null,
      "supports": [],
      "notes": null
    },
    {
      "url": "https://www.eldesconcierto.cl/2016/04/08/dialogo-politico-teatral-con-danilo-llanos-director-de-la-obra-error/",
      "title": "Diálogo político-teatral con Danilo Llanos, director de la obra «Error»",
      "publisher": "El Desconcierto",
      "type": "prensa",
      "level": 2,
      "role": "secundaria",
      "accessed_at": "2026-09-05",
      "archived_url": null,
      "supports": [],
      "notes": "Entrevista con detalle sobre fundadoras, núcleo estable, Fondart 2001 y el Encuentro de Teatro Porteño Independiente desde 2004; contenido citado a partir del resumen del buscador."
    },
    {
      "url": "https://www.valparaisocreativo.cl/valparaiso-tiene-algo-que-decir-al-mundo-teatro-la-peste-impulsa-un-plan-para-internacionalizar-el-teatro-regional/",
      "title": "«Valparaíso tiene algo que decir al mundo»: Teatro La Peste impulsa un plan para internacionalizar el teatro regional",
      "publisher": "Valparaíso Creativo",
      "type": "institucional",
      "level": 1,
      "role": "secundaria",
      "accessed_at": "2026-09-05",
      "archived_url": null,
      "supports": [],
      "notes": "El intento de este asistente de abrir la página directamente devolvió un aviso de hosting suspendido (ihosting.cl); el contenido citado proviene del resumen generado por el buscador, no de una lectura directa de la página. Requiere verificación humana."
    },
    {
      "url": "https://www.fondosdecultura.cl/wp-content/uploads/2022/01/SELECCIONADOS-FAAEE-2022.pdf",
      "title": "Seleccionados Fondo de Artes Escénicas 2022",
      "publisher": "Ministerio de las Culturas, las Artes y el Patrimonio — Fondos Cultura",
      "type": "institucional",
      "level": 1,
      "role": "secundaria",
      "accessed_at": "2026-09-08",
      "archived_url": null,
      "supports": [],
      "notes": null
    }
  ],
  "verification": {
    "status": "pendiente",
    "confidence_score": 60,
    "verified_at": null,
    "verified_by": null,
    "next_review_at": null,
    "note": "Importado del catastro regional del ecosistema teatral (Fase 1: descubrimiento); pendiente de verificación editorial."
  },
  "published": false
}
