{
  "slug": "george-casanova",
  "type": "artist",
  "name": "George Casanova",
  "artistic_name": null,
  "commune": "valparaiso",
  "commune_basis": "prensa",
  "crafts": [
    "direccion"
  ],
  "disciplines": [
    "teatro"
  ],
  "specialties": [],
  "bio_md": null,
  "trajectory_md": null,
  "companies": [
    {
      "company": "teatro-del-instinto",
      "role": "Director/a",
      "from_year": null,
      "to_year": null
    }
  ],
  "companies_text": [],
  "works": [],
  "works_text": [],
  "training": [],
  "recognitions": [],
  "funding_awards": [],
  "festivals": [],
  "website": null,
  "social": {
    "instagram": null,
    "facebook": null,
    "tiktok": null,
    "youtube": null
  },
  "email_public": null,
  "contact_authorized": false,
  "media": [],
  "media_candidates": [],
  "series": [],
  "episodes": [],
  "tags": [],
  "sources": [
    {
      "url": "https://centex.cultura.gob.cl/con-ocho-montajes-en-ocho-espacios-distintos-valparaiso-celebra-mes-del-teatro/",
      "title": "Ciudad Teatro: con ocho montajes en ocho espacios distintos Valparaíso celebra el Mes del Teatro",
      "publisher": "Centex — Centro de Extensión del Ministerio de las Culturas, las Artes y el Patrimonio",
      "type": "institucional",
      "level": 1,
      "role": "primaria",
      "accessed_at": "2026-09-08",
      "archived_url": null,
      "supports": [],
      "notes": "Nota de 2025 con programa completo: 8 funciones entre el 5 y el 11 de mayo de 2025 en Valparaíso. Gratuidad no especificada."
    }
  ],
  "verification": {
    "status": "pendiente",
    "confidence_score": 60,
    "verified_at": null,
    "verified_by": null,
    "next_review_at": null,
    "note": "Importado del catastro regional del ecosistema teatral (Fase 1: descubrimiento); pendiente de verificación editorial."
  },
  "published": false
}
