{
  "slug": "festin-de-la-risa-creacion-colectiva",
  "type": "artist",
  "name": "Festín de la Risa (creación colectiva)",
  "artistic_name": null,
  "commune": "valparaiso",
  "commune_basis": "prensa",
  "crafts": [
    "dramaturgia"
  ],
  "disciplines": [
    "teatro"
  ],
  "specialties": [],
  "bio_md": null,
  "trajectory_md": null,
  "companies": [
    {
      "company": "festin-de-la-risa",
      "role": "Dramaturgo/a",
      "from_year": null,
      "to_year": null
    }
  ],
  "companies_text": [],
  "works": [],
  "works_text": [],
  "training": [],
  "recognitions": [],
  "funding_awards": [],
  "festivals": [],
  "website": null,
  "social": {
    "instagram": null,
    "facebook": null,
    "tiktok": null,
    "youtube": null
  },
  "email_public": null,
  "contact_authorized": false,
  "media": [],
  "media_candidates": [],
  "series": [],
  "episodes": [],
  "tags": [],
  "sources": [
    {
      "url": null,
      "title": "Investigación madre Quinta Escena Podcast — perfil 2",
      "publisher": "Proyecto Quinta Escena Podcast, folio 863000",
      "type": "documento-proyecto",
      "level": 3,
      "role": "primaria",
      "accessed_at": "2026-09-05",
      "archived_url": null,
      "supports": [],
      "notes": "Documento interno del proyecto Quinta Escena Podcast; no verificable públicamente. URL pendiente."
    }
  ],
  "verification": {
    "status": "pendiente",
    "confidence_score": 35,
    "verified_at": null,
    "verified_by": null,
    "next_review_at": null,
    "note": "Importado del catastro regional del ecosistema teatral (Fase 1: descubrimiento); pendiente de verificación editorial."
  },
  "published": false
}
